{
  "schemaVersion": "1.0.0",
  "seatId": "9faf553c-2b9d-5d3b-91f4-c7d2f64f132e",
  "seatKey": "fl-pinellas-county-supervisor-of-elections-at-large",
  "seatName": "Pinellas County Supervisor of Elections",
  "officeType": "supervisor_of_elections",
  "governmentLevel": "county",
  "branch": "executive",
  "chamber": null,
  "jurisdictionId": "f4fca445-a9d4-5098-af64-78553013b89a",
  "jurisdictionName": "Pinellas County",
  "stateCode": "FL",
  "districtName": "Pinellas County",
  "districtNumber": null,
  "seatAtLarge": true,
  "occupancyStatus": "unknown",
  "currentTermId": null,
  "currentPersonId": null,
  "termHistoryIds": [],
  "sourceUrls": [],
  "evidenceIds": [],
  "monitoring": {
    "active": false,
    "occupancyCheckClass": "manual",
    "lastCheckedAt": null,
    "lastChangedAt": null,
    "nextScheduledCheckAt": null,
    "changeReason": null
  },
  "researchContractKey": "florida-county-constitutional-officer",
  "ledgerStatus": "expected",
  "discoveryStatus": "declared_from_registry",
  "occupancyVerificationStatus": "UNKNOWN",
  "coverageRegion": "remaining",
  "createdAt": "2026-09-01T22:30:00Z",
  "lastUpdatedAt": "2026-09-01T22:30:00Z"
}
