{
  "schemaVersion": "1.0.0",
  "seatId": "d97c0437-7dee-5418-abea-5d00fc042c77",
  "seatKey": "fl-florida-state-representative-district-16-16",
  "seatName": "Florida State Representative, District 16",
  "officeType": "state_representative",
  "governmentLevel": "state",
  "branch": "legislative",
  "chamber": "house",
  "jurisdictionId": "d97d0006-4206-514d-ab2e-25611155d60d",
  "jurisdictionName": "Florida",
  "stateCode": "FL",
  "districtName": "District 16",
  "districtNumber": "16",
  "seatAtLarge": false,
  "occupancyStatus": "unknown",
  "currentTermId": null,
  "currentPersonId": "cab73259-17d4-57d6-bd66-50241314b6a3",
  "termHistoryIds": [],
  "sourceUrls": [
    "https://www.myfloridahouse.gov/Sections/Representatives/representatives.aspx"
  ],
  "evidenceIds": [],
  "monitoring": {
    "active": false,
    "occupancyCheckClass": "manual",
    "lastCheckedAt": null,
    "lastChangedAt": null,
    "nextScheduledCheckAt": null,
    "changeReason": null
  },
  "researchContractKey": "florida-state-legislator",
  "ledgerStatus": "expected",
  "discoveryStatus": "declared_from_count",
  "occupancyVerificationStatus": "RECOVERED",
  "coverageRegion": "statewide",
  "createdAt": "2026-09-01T22:30:00Z",
  "lastUpdatedAt": "2026-09-01T22:30:00Z"
}
