{
  "schemaVersion": "1.0.0",
  "seatId": "1d21373c-abb6-5fb7-b751-fb0b0bf0939f",
  "seatKey": "fl-collier-county-clerk-of-the-circuit-court-and-comptroller-at-large",
  "seatName": "Collier County Clerk of the Circuit Court and Comptroller",
  "officeType": "clerk_of_circuit_court_and_comptroller",
  "governmentLevel": "county",
  "branch": "executive",
  "chamber": null,
  "jurisdictionId": "15625f4e-dd33-5293-92da-155986f935a3",
  "jurisdictionName": "Collier County",
  "stateCode": "FL",
  "districtName": "Collier County",
  "districtNumber": null,
  "seatAtLarge": true,
  "occupancyStatus": "unknown",
  "currentTermId": null,
  "currentPersonId": null,
  "termHistoryIds": [],
  "sourceUrls": [],
  "evidenceIds": [],
  "monitoring": {
    "active": false,
    "occupancyCheckClass": "manual",
    "lastCheckedAt": null,
    "lastChangedAt": null,
    "nextScheduledCheckAt": null,
    "changeReason": null
  },
  "researchContractKey": "florida-county-constitutional-officer",
  "ledgerStatus": "expected",
  "discoveryStatus": "declared_from_registry",
  "occupancyVerificationStatus": "UNKNOWN",
  "coverageRegion": "remaining",
  "createdAt": "2026-09-01T22:30:00Z",
  "lastUpdatedAt": "2026-09-01T22:30:00Z"
}
