{
  "schemaVersion": "1.0.0",
  "seatId": "0724da29-7506-5e8f-8d8e-b120cd172a6d",
  "seatKey": "fl-citrus-county-supervisor-of-elections-at-large",
  "seatName": "Citrus County Supervisor of Elections",
  "officeType": "supervisor_of_elections",
  "governmentLevel": "county",
  "branch": "executive",
  "chamber": null,
  "jurisdictionId": "fd236731-5347-5665-8106-02c20b71c532",
  "jurisdictionName": "Citrus County",
  "stateCode": "FL",
  "districtName": "Citrus County",
  "districtNumber": null,
  "seatAtLarge": true,
  "occupancyStatus": "unknown",
  "currentTermId": null,
  "currentPersonId": null,
  "termHistoryIds": [],
  "sourceUrls": [],
  "evidenceIds": [],
  "monitoring": {
    "active": false,
    "occupancyCheckClass": "manual",
    "lastCheckedAt": null,
    "lastChangedAt": null,
    "nextScheduledCheckAt": null,
    "changeReason": null
  },
  "researchContractKey": "florida-county-constitutional-officer",
  "ledgerStatus": "expected",
  "discoveryStatus": "declared_from_registry",
  "occupancyVerificationStatus": "UNKNOWN",
  "coverageRegion": "remaining",
  "createdAt": "2026-09-01T22:30:00Z",
  "lastUpdatedAt": "2026-09-01T22:30:00Z"
}
