{
  "schemaVersion": "1.0.0",
  "seatId": "2d5c7eef-f264-574f-bccd-f04b65034730",
  "seatKey": "fl-florida-state-senator-district-21-21",
  "seatName": "Florida State Senator, District 21",
  "officeType": "state_senator",
  "governmentLevel": "state",
  "branch": "legislative",
  "chamber": "senate",
  "jurisdictionId": "d97d0006-4206-514d-ab2e-25611155d60d",
  "jurisdictionName": "Florida",
  "stateCode": "FL",
  "districtName": "District 21",
  "districtNumber": "21",
  "seatAtLarge": false,
  "occupancyStatus": "unknown",
  "currentTermId": null,
  "currentPersonId": "9d8a41d4-45b6-5b44-a395-900e8caca308",
  "termHistoryIds": [],
  "sourceUrls": [
    "https://www.flsenate.gov/Senators"
  ],
  "evidenceIds": [],
  "monitoring": {
    "active": false,
    "occupancyCheckClass": "manual",
    "lastCheckedAt": null,
    "lastChangedAt": null,
    "nextScheduledCheckAt": null,
    "changeReason": null
  },
  "researchContractKey": "florida-state-legislator",
  "ledgerStatus": "expected",
  "discoveryStatus": "declared_from_count",
  "occupancyVerificationStatus": "RECOVERED",
  "coverageRegion": "statewide",
  "createdAt": "2026-09-01T22:30:00Z",
  "lastUpdatedAt": "2026-09-01T22:30:00Z"
}
