{
  "schemaVersion": "1.0.0",
  "seatId": "c3217c40-606b-5a7e-b56a-6492850b1650",
  "seatKey": "fl-hamilton-county-clerk-of-the-circuit-court-and-comptroller-at-large",
  "seatName": "Hamilton County Clerk of the Circuit Court and Comptroller",
  "officeType": "clerk_of_circuit_court_and_comptroller",
  "governmentLevel": "county",
  "branch": "executive",
  "chamber": null,
  "jurisdictionId": "614c6860-9214-5888-a283-0e3aa160992f",
  "jurisdictionName": "Hamilton County",
  "stateCode": "FL",
  "districtName": "Hamilton County",
  "districtNumber": null,
  "seatAtLarge": true,
  "occupancyStatus": "unknown",
  "currentTermId": null,
  "currentPersonId": null,
  "termHistoryIds": [],
  "sourceUrls": [],
  "evidenceIds": [],
  "monitoring": {
    "active": false,
    "occupancyCheckClass": "manual",
    "lastCheckedAt": null,
    "lastChangedAt": null,
    "nextScheduledCheckAt": null,
    "changeReason": null
  },
  "researchContractKey": "florida-county-constitutional-officer",
  "ledgerStatus": "expected",
  "discoveryStatus": "declared_from_registry",
  "occupancyVerificationStatus": "UNKNOWN",
  "coverageRegion": "remaining",
  "createdAt": "2026-09-01T22:30:00Z",
  "lastUpdatedAt": "2026-09-01T22:30:00Z"
}
