{
  "schemaVersion": "1.0.0",
  "seatId": "dd43d328-0b50-5134-a020-0536d1003656",
  "seatKey": "fl-bay-county-property-appraiser-at-large",
  "seatName": "Bay County Property Appraiser",
  "officeType": "property_appraiser",
  "governmentLevel": "county",
  "branch": "executive",
  "chamber": null,
  "jurisdictionId": "5f5ae9a0-b3a5-5ad2-ab92-23d291bad8cf",
  "jurisdictionName": "Bay County",
  "stateCode": "FL",
  "districtName": "Bay County",
  "districtNumber": null,
  "seatAtLarge": true,
  "occupancyStatus": "unknown",
  "currentTermId": null,
  "currentPersonId": null,
  "termHistoryIds": [],
  "sourceUrls": [],
  "evidenceIds": [],
  "monitoring": {
    "active": false,
    "occupancyCheckClass": "manual",
    "lastCheckedAt": null,
    "lastChangedAt": null,
    "nextScheduledCheckAt": null,
    "changeReason": null
  },
  "researchContractKey": "florida-county-constitutional-officer",
  "ledgerStatus": "expected",
  "discoveryStatus": "declared_from_registry",
  "occupancyVerificationStatus": "UNKNOWN",
  "coverageRegion": "remaining",
  "createdAt": "2026-09-01T22:30:00Z",
  "lastUpdatedAt": "2026-09-01T22:30:00Z"
}
