{
  "schemaVersion": "1.0.0",
  "seatId": "d890d318-019e-5bac-9ea4-7b874a0ec8b6",
  "seatKey": "fl-florida-state-senator-district-36-36",
  "seatName": "Florida State Senator, District 36",
  "officeType": "state_senator",
  "governmentLevel": "state",
  "branch": "legislative",
  "chamber": "senate",
  "jurisdictionId": "d97d0006-4206-514d-ab2e-25611155d60d",
  "jurisdictionName": "Florida",
  "stateCode": "FL",
  "districtName": "District 36",
  "districtNumber": "36",
  "seatAtLarge": false,
  "occupancyStatus": "unknown",
  "currentTermId": null,
  "currentPersonId": "c2f05808-cee2-5407-aa0d-13d17aecb434",
  "termHistoryIds": [],
  "sourceUrls": [
    "https://www.flsenate.gov/Senators"
  ],
  "evidenceIds": [],
  "monitoring": {
    "active": false,
    "occupancyCheckClass": "manual",
    "lastCheckedAt": null,
    "lastChangedAt": null,
    "nextScheduledCheckAt": null,
    "changeReason": null
  },
  "researchContractKey": "florida-state-legislator",
  "ledgerStatus": "expected",
  "discoveryStatus": "declared_from_count",
  "occupancyVerificationStatus": "RECOVERED",
  "coverageRegion": "statewide",
  "createdAt": "2026-09-01T22:30:00Z",
  "lastUpdatedAt": "2026-09-01T22:30:00Z"
}
