{
  "schemaVersion": "1.0.0",
  "seatId": "40daa9b5-12cc-5d0d-bda3-9d4d8e21ad0e",
  "seatKey": "fl-florida-state-senator-district-17-17",
  "seatName": "Florida State Senator, District 17",
  "officeType": "state_senator",
  "governmentLevel": "state",
  "branch": "legislative",
  "chamber": "senate",
  "jurisdictionId": "d97d0006-4206-514d-ab2e-25611155d60d",
  "jurisdictionName": "Florida",
  "stateCode": "FL",
  "districtName": "District 17",
  "districtNumber": "17",
  "seatAtLarge": false,
  "occupancyStatus": "unknown",
  "currentTermId": null,
  "currentPersonId": "b4999602-5a06-5661-93f3-ea446a8c0827",
  "termHistoryIds": [],
  "sourceUrls": [
    "https://www.flsenate.gov/Senators"
  ],
  "evidenceIds": [],
  "monitoring": {
    "active": false,
    "occupancyCheckClass": "manual",
    "lastCheckedAt": null,
    "lastChangedAt": null,
    "nextScheduledCheckAt": null,
    "changeReason": null
  },
  "researchContractKey": "florida-state-legislator",
  "ledgerStatus": "expected",
  "discoveryStatus": "declared_from_count",
  "occupancyVerificationStatus": "RECOVERED",
  "coverageRegion": "statewide",
  "createdAt": "2026-09-01T22:30:00Z",
  "lastUpdatedAt": "2026-09-01T22:30:00Z"
}
