{
  "schemaVersion": "1.0.0",
  "seatId": "8fde9dc1-9dd4-5e1f-881c-2f0072de655c",
  "seatKey": "fl-polk-county-supervisor-of-elections-at-large",
  "seatName": "Polk County Supervisor of Elections",
  "officeType": "supervisor_of_elections",
  "governmentLevel": "county",
  "branch": "executive",
  "chamber": null,
  "jurisdictionId": "d37dfb58-f783-5342-beef-bbc1a560bdf0",
  "jurisdictionName": "Polk County",
  "stateCode": "FL",
  "districtName": "Polk County",
  "districtNumber": null,
  "seatAtLarge": true,
  "occupancyStatus": "unknown",
  "currentTermId": null,
  "currentPersonId": null,
  "termHistoryIds": [],
  "sourceUrls": [],
  "evidenceIds": [],
  "monitoring": {
    "active": false,
    "occupancyCheckClass": "manual",
    "lastCheckedAt": null,
    "lastChangedAt": null,
    "nextScheduledCheckAt": null,
    "changeReason": null
  },
  "researchContractKey": "florida-county-constitutional-officer",
  "ledgerStatus": "expected",
  "discoveryStatus": "declared_from_registry",
  "occupancyVerificationStatus": "UNKNOWN",
  "coverageRegion": "remaining",
  "createdAt": "2026-09-01T22:30:00Z",
  "lastUpdatedAt": "2026-09-01T22:30:00Z"
}
