{
  "schemaVersion": "1.0.0",
  "seatId": "5bc5132c-5de6-526e-b5ba-5eb2240c9729",
  "seatKey": "fl-united-states-representative-18",
  "seatName": "United States Representative, Florida District 18",
  "officeType": "us_representative",
  "governmentLevel": "federal",
  "branch": "legislative",
  "chamber": "house",
  "jurisdictionId": "d97d0006-4206-514d-ab2e-25611155d60d",
  "jurisdictionName": "Florida",
  "stateCode": "FL",
  "districtName": "District 18",
  "districtNumber": "18",
  "seatAtLarge": false,
  "occupancyStatus": "unknown",
  "currentTermId": null,
  "currentPersonId": "6ed49507-3f4c-5640-a339-c63229137e0e",
  "termHistoryIds": [],
  "sourceUrls": [
    "https://www.house.gov/representatives"
  ],
  "evidenceIds": [],
  "monitoring": {
    "active": false,
    "occupancyCheckClass": "manual",
    "lastCheckedAt": null,
    "lastChangedAt": null,
    "nextScheduledCheckAt": null,
    "changeReason": null
  },
  "researchContractKey": "us-legislator",
  "ledgerStatus": "expected",
  "discoveryStatus": "declared_from_count",
  "occupancyVerificationStatus": "RECOVERED",
  "coverageRegion": "statewide",
  "createdAt": "2026-09-01T22:30:00Z",
  "lastUpdatedAt": "2026-09-01T22:30:00Z"
}
