{
  "schemaVersion": "1.0.0",
  "seatId": "a3bcfb68-4378-5fd9-8bc0-6341bb0aff1e",
  "seatKey": "fl-jackson-county-tax-collector-at-large",
  "seatName": "Jackson County Tax Collector",
  "officeType": "tax_collector",
  "governmentLevel": "county",
  "branch": "executive",
  "chamber": null,
  "jurisdictionId": "70f7b5f5-3903-5689-b323-ec12a9fe59cd",
  "jurisdictionName": "Jackson County",
  "stateCode": "FL",
  "districtName": "Jackson County",
  "districtNumber": null,
  "seatAtLarge": true,
  "occupancyStatus": "unknown",
  "currentTermId": null,
  "currentPersonId": null,
  "termHistoryIds": [],
  "sourceUrls": [],
  "evidenceIds": [],
  "monitoring": {
    "active": false,
    "occupancyCheckClass": "manual",
    "lastCheckedAt": null,
    "lastChangedAt": null,
    "nextScheduledCheckAt": null,
    "changeReason": null
  },
  "researchContractKey": "florida-county-constitutional-officer",
  "ledgerStatus": "expected",
  "discoveryStatus": "declared_from_registry",
  "occupancyVerificationStatus": "UNKNOWN",
  "coverageRegion": "remaining",
  "createdAt": "2026-09-01T22:30:00Z",
  "lastUpdatedAt": "2026-09-01T22:30:00Z"
}
