{
  "schemaVersion": "1.0.0",
  "seatId": "8b901ab4-592f-5fa6-a38e-514f3eeff4bf",
  "seatKey": "fl-lee-county-clerk-of-the-circuit-court-and-comptroller-at-large",
  "seatName": "Lee County Clerk of the Circuit Court and Comptroller",
  "officeType": "clerk_of_circuit_court_and_comptroller",
  "governmentLevel": "county",
  "branch": "executive",
  "chamber": null,
  "jurisdictionId": "6be7d5be-9c55-52c5-a760-99c1aa837e1a",
  "jurisdictionName": "Lee County",
  "stateCode": "FL",
  "districtName": "Lee County",
  "districtNumber": null,
  "seatAtLarge": true,
  "occupancyStatus": "unknown",
  "currentTermId": null,
  "currentPersonId": null,
  "termHistoryIds": [],
  "sourceUrls": [],
  "evidenceIds": [],
  "monitoring": {
    "active": false,
    "occupancyCheckClass": "manual",
    "lastCheckedAt": null,
    "lastChangedAt": null,
    "nextScheduledCheckAt": null,
    "changeReason": null
  },
  "researchContractKey": "florida-county-constitutional-officer",
  "ledgerStatus": "expected",
  "discoveryStatus": "declared_from_registry",
  "occupancyVerificationStatus": "UNKNOWN",
  "coverageRegion": "remaining",
  "createdAt": "2026-09-01T22:30:00Z",
  "lastUpdatedAt": "2026-09-01T22:30:00Z"
}
