{
  "schemaVersion": "1.0.0",
  "seatId": "efc77618-584f-5da5-9b0e-603a5c769be2",
  "seatKey": "fl-washington-county-tax-collector-at-large",
  "seatName": "Washington County Tax Collector",
  "officeType": "tax_collector",
  "governmentLevel": "county",
  "branch": "executive",
  "chamber": null,
  "jurisdictionId": "ed7372d8-9463-529d-86d5-568e9fcf83e8",
  "jurisdictionName": "Washington County",
  "stateCode": "FL",
  "districtName": "Washington County",
  "districtNumber": null,
  "seatAtLarge": true,
  "occupancyStatus": "unknown",
  "currentTermId": null,
  "currentPersonId": null,
  "termHistoryIds": [],
  "sourceUrls": [],
  "evidenceIds": [],
  "monitoring": {
    "active": false,
    "occupancyCheckClass": "manual",
    "lastCheckedAt": null,
    "lastChangedAt": null,
    "nextScheduledCheckAt": null,
    "changeReason": null
  },
  "researchContractKey": "florida-county-constitutional-officer",
  "ledgerStatus": "expected",
  "discoveryStatus": "declared_from_registry",
  "occupancyVerificationStatus": "UNKNOWN",
  "coverageRegion": "remaining",
  "createdAt": "2026-09-01T22:30:00Z",
  "lastUpdatedAt": "2026-09-01T22:30:00Z"
}
