{
  "schemaVersion": "1.0.0",
  "seatId": "5627d0e0-9be3-5864-9446-f800dead3654",
  "seatKey": "fl-walton-county-supervisor-of-elections-at-large",
  "seatName": "Walton County Supervisor of Elections",
  "officeType": "supervisor_of_elections",
  "governmentLevel": "county",
  "branch": "executive",
  "chamber": null,
  "jurisdictionId": "8aa04a7d-554d-50ec-a64b-ce7aa238c70b",
  "jurisdictionName": "Walton County",
  "stateCode": "FL",
  "districtName": "Walton County",
  "districtNumber": null,
  "seatAtLarge": true,
  "occupancyStatus": "unknown",
  "currentTermId": null,
  "currentPersonId": null,
  "termHistoryIds": [],
  "sourceUrls": [],
  "evidenceIds": [],
  "monitoring": {
    "active": false,
    "occupancyCheckClass": "manual",
    "lastCheckedAt": null,
    "lastChangedAt": null,
    "nextScheduledCheckAt": null,
    "changeReason": null
  },
  "researchContractKey": "florida-county-constitutional-officer",
  "ledgerStatus": "expected",
  "discoveryStatus": "declared_from_registry",
  "occupancyVerificationStatus": "UNKNOWN",
  "coverageRegion": "remaining",
  "createdAt": "2026-09-01T22:30:00Z",
  "lastUpdatedAt": "2026-09-01T22:30:00Z"
}
