{
  "schemaVersion": "1.0.0",
  "seatId": "1dfe5297-1d70-5b28-9054-1b7abed4c646",
  "seatKey": "fl-leon-county-supervisor-of-elections-at-large",
  "seatName": "Leon County Supervisor of Elections",
  "officeType": "supervisor_of_elections",
  "governmentLevel": "county",
  "branch": "executive",
  "chamber": null,
  "jurisdictionId": "15275fa8-9328-58e2-ad67-2169f2589e2c",
  "jurisdictionName": "Leon County",
  "stateCode": "FL",
  "districtName": "Leon County",
  "districtNumber": null,
  "seatAtLarge": true,
  "occupancyStatus": "unknown",
  "currentTermId": null,
  "currentPersonId": null,
  "termHistoryIds": [],
  "sourceUrls": [],
  "evidenceIds": [],
  "monitoring": {
    "active": false,
    "occupancyCheckClass": "manual",
    "lastCheckedAt": null,
    "lastChangedAt": null,
    "nextScheduledCheckAt": null,
    "changeReason": null
  },
  "researchContractKey": "florida-county-constitutional-officer",
  "ledgerStatus": "expected",
  "discoveryStatus": "declared_from_registry",
  "occupancyVerificationStatus": "UNKNOWN",
  "coverageRegion": "remaining",
  "createdAt": "2026-09-01T22:30:00Z",
  "lastUpdatedAt": "2026-09-01T22:30:00Z"
}
