{
  "schemaVersion": "1.0.0",
  "seatId": "5d9d8e9c-5409-56f4-8068-629cc569278a",
  "seatKey": "fl-columbia-county-property-appraiser-at-large",
  "seatName": "Columbia County Property Appraiser",
  "officeType": "property_appraiser",
  "governmentLevel": "county",
  "branch": "executive",
  "chamber": null,
  "jurisdictionId": "1d2f3d6a-6a12-591c-8b3e-eae9d9e37ea5",
  "jurisdictionName": "Columbia County",
  "stateCode": "FL",
  "districtName": "Columbia County",
  "districtNumber": null,
  "seatAtLarge": true,
  "occupancyStatus": "unknown",
  "currentTermId": null,
  "currentPersonId": null,
  "termHistoryIds": [],
  "sourceUrls": [],
  "evidenceIds": [],
  "monitoring": {
    "active": false,
    "occupancyCheckClass": "manual",
    "lastCheckedAt": null,
    "lastChangedAt": null,
    "nextScheduledCheckAt": null,
    "changeReason": null
  },
  "researchContractKey": "florida-county-constitutional-officer",
  "ledgerStatus": "expected",
  "discoveryStatus": "declared_from_registry",
  "occupancyVerificationStatus": "UNKNOWN",
  "coverageRegion": "remaining",
  "createdAt": "2026-09-01T22:30:00Z",
  "lastUpdatedAt": "2026-09-01T22:30:00Z"
}
