{
  "schemaVersion": "1.0.0",
  "seatId": "6e0f8690-88f1-5134-9c5b-92c05a468608",
  "seatKey": "fl-martin-county-tax-collector-at-large",
  "seatName": "Martin County Tax Collector",
  "officeType": "tax_collector",
  "governmentLevel": "county",
  "branch": "executive",
  "chamber": null,
  "jurisdictionId": "d8763a4e-9dcc-569a-8552-87d62bdbd298",
  "jurisdictionName": "Martin County",
  "stateCode": "FL",
  "districtName": "Martin County",
  "districtNumber": null,
  "seatAtLarge": true,
  "occupancyStatus": "unknown",
  "currentTermId": null,
  "currentPersonId": null,
  "termHistoryIds": [],
  "sourceUrls": [],
  "evidenceIds": [],
  "monitoring": {
    "active": false,
    "occupancyCheckClass": "manual",
    "lastCheckedAt": null,
    "lastChangedAt": null,
    "nextScheduledCheckAt": null,
    "changeReason": null
  },
  "researchContractKey": "florida-county-constitutional-officer",
  "ledgerStatus": "expected",
  "discoveryStatus": "declared_from_registry",
  "occupancyVerificationStatus": "UNKNOWN",
  "coverageRegion": "remaining",
  "createdAt": "2026-09-01T22:30:00Z",
  "lastUpdatedAt": "2026-09-01T22:30:00Z"
}
