{
  "schemaVersion": "1.0.0",
  "seatId": "b70fef4a-53e6-50fc-b176-2ea96af9f0d8",
  "seatKey": "fl-suwannee-county-sheriff-at-large",
  "seatName": "Suwannee County Sheriff",
  "officeType": "sheriff",
  "governmentLevel": "county",
  "branch": "executive",
  "chamber": null,
  "jurisdictionId": "e6f0cb9b-9a0f-5e1a-a2d2-eff1b2f831e7",
  "jurisdictionName": "Suwannee County",
  "stateCode": "FL",
  "districtName": "Suwannee County",
  "districtNumber": null,
  "seatAtLarge": true,
  "occupancyStatus": "unknown",
  "currentTermId": null,
  "currentPersonId": null,
  "termHistoryIds": [],
  "sourceUrls": [],
  "evidenceIds": [],
  "monitoring": {
    "active": false,
    "occupancyCheckClass": "manual",
    "lastCheckedAt": null,
    "lastChangedAt": null,
    "nextScheduledCheckAt": null,
    "changeReason": null
  },
  "researchContractKey": "florida-county-constitutional-officer",
  "ledgerStatus": "expected",
  "discoveryStatus": "declared_from_registry",
  "occupancyVerificationStatus": "UNKNOWN",
  "coverageRegion": "remaining",
  "createdAt": "2026-09-01T22:30:00Z",
  "lastUpdatedAt": "2026-09-01T22:30:00Z"
}
