{
  "schemaVersion": "1.0.0",
  "seatId": "e73626c2-80f1-5ffd-9ff0-0e35ce7b2d39",
  "seatKey": "fl-united-states-representative-3",
  "seatName": "United States Representative, Florida District 3",
  "officeType": "us_representative",
  "governmentLevel": "federal",
  "branch": "legislative",
  "chamber": "house",
  "jurisdictionId": "d97d0006-4206-514d-ab2e-25611155d60d",
  "jurisdictionName": "Florida",
  "stateCode": "FL",
  "districtName": "District 3",
  "districtNumber": "3",
  "seatAtLarge": false,
  "occupancyStatus": "unknown",
  "currentTermId": null,
  "currentPersonId": "ca677276-b0c0-54a9-82ca-0aa47ffefc7e",
  "termHistoryIds": [],
  "sourceUrls": [
    "https://www.house.gov/representatives"
  ],
  "evidenceIds": [],
  "monitoring": {
    "active": false,
    "occupancyCheckClass": "manual",
    "lastCheckedAt": null,
    "lastChangedAt": null,
    "nextScheduledCheckAt": null,
    "changeReason": null
  },
  "researchContractKey": "us-legislator",
  "ledgerStatus": "expected",
  "discoveryStatus": "declared_from_count",
  "occupancyVerificationStatus": "RECOVERED",
  "coverageRegion": "statewide",
  "createdAt": "2026-09-01T22:30:00Z",
  "lastUpdatedAt": "2026-09-01T22:30:00Z"
}
