{
  "schemaVersion": "1.0.0",
  "seatId": "8985ff2e-4bce-50aa-93c8-e17eec9eefdb",
  "seatKey": "fl-florida-state-senator-district-7-7",
  "seatName": "Florida State Senator, District 7",
  "officeType": "state_senator",
  "governmentLevel": "state",
  "branch": "legislative",
  "chamber": "senate",
  "jurisdictionId": "d97d0006-4206-514d-ab2e-25611155d60d",
  "jurisdictionName": "Florida",
  "stateCode": "FL",
  "districtName": "District 7",
  "districtNumber": "7",
  "seatAtLarge": false,
  "occupancyStatus": "unknown",
  "currentTermId": null,
  "currentPersonId": "adb1082b-c87a-5759-bd64-81b01f0da549",
  "termHistoryIds": [],
  "sourceUrls": [
    "https://www.flsenate.gov/Senators"
  ],
  "evidenceIds": [],
  "monitoring": {
    "active": false,
    "occupancyCheckClass": "manual",
    "lastCheckedAt": null,
    "lastChangedAt": null,
    "nextScheduledCheckAt": null,
    "changeReason": null
  },
  "researchContractKey": "florida-state-legislator",
  "ledgerStatus": "expected",
  "discoveryStatus": "declared_from_count",
  "occupancyVerificationStatus": "RECOVERED",
  "coverageRegion": "statewide",
  "createdAt": "2026-09-01T22:30:00Z",
  "lastUpdatedAt": "2026-09-01T22:30:00Z"
}
